{"run":27,"commit":"cb9bbbf","metric":35.48,"metrics":{"analyzer_seconds":29.917,"peak_rss_mb":1198,"user_cpu_seconds":353.56,"sys_cpu_seconds":31.23,"violations":18545,"build_seconds":0.48},"status":"keep","description":"Parallelize file walking with depth-2 fan-out + parallelize filter_files_by_size. Both use a *local* rayon ThreadPool (since the global one isn't initialized until later in main, after initialize_v8). Two-level fan-out is critical for monorepos like dd-source where one mid-tree directory (`domains/`) holds ~95% of files: without depth-2, only the top 23 dirs run in parallel and `domains/` becomes a sequential bottleneck. With depth-2, we surface 200+ leaf subtrees that map cleanly onto rayon workers.","timestamp":1777752614744,"segment":0,"confidence":8.693392425463333,"asi":{"hypothesis":"the 18s of post-analyzer overhead is dominated by sequential file walking via WalkDir on 272k files. Adding instrumentation revealed get_files takes 13s and filter_files_by_size takes 2.5s.","delta_vs_prev_best_s":-11.9,"delta_vs_baseline_s":-215.77,"pct_vs_baseline":-85.88,"delta_user_cpu_s":10.5,"delta_peak_rss_mb":-151,"fingerprints":"10/10 match","implementation":"(a) get_files: read top-level entries, then for each subdirectory ALSO read its immediate entries, fan out depth-2 subdirs as parallel work-list. Local ThreadPool (sized to num_cpus) sidesteps the global pool which is initialized later in main. (b) filter_files_by_size: par_iter over files for the metadata + is_file syscalls, also via a local pool.","depth_iteration_story":"first try (single-level fan-out) only saved ~2s because dd-source/domains/ is one giant subtree that became a bottleneck. depth-2 fan-out saves ~10s by spreading domains/'s ~255 sub-subdirs across all 16 cores.","verification":"two runs: 37.36, 35.48. Mean 36.42. Spread 1.9s.","memory_note":"peak_rss DROPPED from 1348 → 1198 MB. The parallel walk seems to allocate slightly less than the single-threaded walk (probably due to faster Vec growth pattern with smaller per-thread Vec accumulators).","scope_check":"this is a generally-useful optimization, not a benchmark-specific tweak. ANY large-monorepo scan benefits."}}
{"run":28,"commit":"96ad0e2","metric":33.68,"metrics":{"analyzer_seconds":28.069,"peak_rss_mb":1417,"user_cpu_seconds":371.49,"sys_cpu_seconds":33.12,"violations":18545,"build_seconds":0.48},"status":"keep","description":"Drop the conservative `* 0.9` factor in get_num_threads_to_use, lifting analyzer's rayon worker count from 13 to 15 on 16-core hosts. Previously discarded in run #18 as within noise; retried after run #27 (parallel file walking) shifted where the bottleneck sits. Now gives a real 5% wall improvement (35.48 → 33.68) because rayon's analyzer pool is the dominant CPU consumer once file walking is no longer the long pole.","timestamp":1777752948261,"segment":0,"confidence":9.182105929520993,"asi":{"hypothesis":"the * 0.9 conservative factor is leaving headroom that work-stealing can fill. Run #18 saw ~1s improvement (within noise then) but the file-walking bottleneck was masking the impact. Now that walking is parallelized, more analyzer threads = more analyzer parallelism.","delta_vs_prev_best_s":-1.79,"delta_vs_baseline_s":-217.57,"pct_vs_baseline":-86.6,"delta_user_cpu_s":17.93,"delta_peak_rss_mb":280,"fingerprints":"10/10 match","verification":"two runs at 33.70 / 33.68, mean 33.69, spread 0.02s. Highly stable.","memory_note":"peak_rss rose 1198 → 1417 MB (+18%). 2 more workers × each holding its own v8 isolate + script cache. Still well under the resource-gate threshold.","lesson_learned":"discards aren't always permanent — the same change can succeed after a different bottleneck is removed. Re-trying previously-noise-floor changes after a major shift in the workload structure is worthwhile."}}
{"run":29,"commit":"96ad0e2","metric":35.05,"metrics":{"analyzer_seconds":29.499,"peak_rss_mb":1369,"user_cpu_seconds":371.4,"sys_cpu_seconds":33.03,"violations":18545,"build_seconds":0.49},"status":"discard","description":"Pre-index rules by id in a HashMap for SARIF generate_results lookups instead of linear scan. Discarded: 34.20 / 35.05 vs prev best 33.68 — within noise (~1s). The expected savings (~280ms estimated) were lost in benchmark variance.","timestamp":1777753351708,"segment":0,"confidence":9.639787328311915,"asi":{"hypothesis":"linear scan rules.iter().position() per RuleResult is O(N×M); HashMap should make it O(1).","rollback_reason":"no measurable improvement on dd-source; two runs at 34.20/35.05 vs prev 33.68. Estimated savings (~280ms) were below the ~1s noise floor at this metric level. The optimization is *correct* and theoretically faster; just not visible above noise.","fingerprints":"10/10 match","next_action_hint":"for sub-second wins on a 33s metric, need a tighter benchmark (multiple runs, lower variance) to see effects. Sticking with current best."}}
{"run":30,"commit":"96ad0e2","metric":33.6,"metrics":{"analyzer_seconds":28.024,"peak_rss_mb":1431,"user_cpu_seconds":369.91,"sys_cpu_seconds":33.29,"violations":18545,"build_seconds":0.48},"status":"discard","description":"Stability verification (no code changes after run #29 revert). 33.60 s vs prev best 33.68 s — within ±0.1 s of three measurements (33.60/33.68/33.70). Plateau is genuine and tight; further wins below the ~1 s noise floor are essentially unmeasurable on this benchmark setup.","timestamp":1777753697323,"segment":0,"confidence":12.529225453498418,"asi":{"hypothesis":"verify the 33.68s plateau holds with the current code","rollback_reason":"no code change; logged for measurement only","plateau_stability":"33.60 / 33.68 / 33.70 across 3 separate runs (after run #28 keep). Spread <0.1s. Noise is much tighter than the earlier 1-2s spread — perhaps because warmer caches and stable CPU thermals at ~33s wall. Mean = 33.66s.","session_state":"30 experiments, 14 keeps / 15 discards / 1 measurement-only. Best 33.68 -> ~33.6 plateau. -86.6% wall vs 251s baseline.","last_explorations":"tried HashMap optimization for SARIF (run #29: lost in noise); SARIF parallelization blocked by Rc<Repository> non-Send; GlobSet conversion would be marginal (~0.3s wall) but requires non-trivial refactor.","next_action_hint":"for the user to decide. Below the noise floor here. Promising but unimplemented: GlobSet for path config (small win, refactor cost), SARIF generate_results parallelization (blocked by current type system, would need Repository -> Arc<Repository>), parallel rule conversion at startup (tiny, ~50ms)."}}
{"run":31,"commit":"96ad0e2","metric":34.13,"metrics":{"analyzer_seconds":28.915,"peak_rss_mb":1477,"user_cpu_seconds":372.71,"sys_cpu_seconds":28.79,"violations":18545,"build_seconds":0.48},"status":"discard","description":"Fold size filter into get_files (use WalkDir's cached metadata) to skip the second pass through 272k files in filter_files_by_size. Discarded: 3 runs at 33.59/34.54/34.13 (mean 34.09) vs prev plateau 33.66 — slight regression. Sys_cpu DID drop by ~4s (real syscall savings) but wall didn't improve because the previous filter_files_by_size used `par_iter` over the flat 271k-entry Vec, giving better load balancing across rayon workers than the inline size check during the unbalanced subtree walk (where dd-source's `domains/` subtree dominates).","timestamp":1777754131534,"segment":0,"confidence":10.20497185741088,"asi":{"hypothesis":"second pass through 271k files in filter_files_by_size is redundant work; folding into the walk should save the pass.","rollback_reason":"syscall savings real (~4s sys_cpu drop, consistent across 3 runs) but wall is +0.4s slower on average. The filter_files_by_size par_iter over the flat-Vec evenly distributes work across all 16 threads. The inline size check in get_files_with_size_limit happens during the depth-2 subtree walk where load is unbalanced (`domains/` is 95% of dd-source). Net wash on wall, slight regression on noise.","fingerprints":"10/10 match","lesson_learned":"second-pass filter pattern can be more wall-efficient than inline filter when the second pass has better load balancing. Keep filter_files_by_size as a separate par_iter step.","next_action_hint":"the file walk + size filter is fine as-is. Look elsewhere for wins."}}
{"run":32,"commit":"96ad0e2","metric":34.2,"metrics":{"analyzer_seconds":28.23,"peak_rss_mb":1486,"user_cpu_seconds":371.52,"sys_cpu_seconds":33.06,"violations":18545,"build_seconds":0.47},"status":"discard","description":"Move v8 init + rayon global pool init BEFORE get_files/filter_files_by_size, so they can use the global pool instead of building short-lived local pools. Discarded: 33.89 / 34.20 (mean 34.05) vs prev 33.66 — slight regression. Likely cause: global pool has 15 threads (get_num_threads_to_use(16) = 15) while the prior local pools used num_cpus::get() = 16 — one less worker for walking offsets the saved pool-spawn overhead.","timestamp":1777754573247,"segment":0,"confidence":9.695632798573975,"asi":{"hypothesis":"sharing the rayon global pool across all phases (file walk + filter + analysis) eliminates 2 short-lived local pool spawns (~30 ms saved).","rollback_reason":"slight regression. Global pool sizing (15) is smaller than the local pools' size (16 = num_cpus::get()), so file walking lost one worker thread — net wash or slightly negative on wall, even though we saved local-pool setup overhead.","fingerprints":"10/10 match — correctness preserved.","lesson_learned":"the file-walk and analyzer phases benefit from DIFFERENT thread counts. Walking is syscall-bound and benefits from saturating num_cpus. Analyzer is CPU-bound and benefits from leaving 1 core for v8 watchdog. Sharing one pool sized for analyzer hurts walking slightly. Worth keeping separate pools (or using num_cpus for walking).","next_action_hint":"if revisited: use a separate larger local pool just for walking, keep global pool sized for analysis. But that's basically the current architecture, so accept the plateau."}}
{"run":33,"commit":"96ad0e2","metric":34.88,"metrics":{"analyzer_seconds":29.321,"peak_rss_mb":1454,"user_cpu_seconds":374.16,"sys_cpu_seconds":33.48,"violations":18545,"build_seconds":0.48},"status":"discard","description":"Try `num_cpus` (16 workers) instead of `num_cpus - 1` (15 workers) on 16-core host. Discarded: 3 runs at 34.67/33.61/34.88 (mean 34.39) vs plateau 33.66 — consistent ~0.7s regression. The v8 watchdog thread competes with rayon worker threads for the 16th physical core when all are saturated, causing scheduling contention. The original `num_cpus - 1` correctly leaves headroom.","timestamp":1777754901854,"segment":0,"confidence":10.450048030739673,"asi":{"hypothesis":"use all 16 cores for analyzer workers since v8 watchdog runs on a separate thread that wouldn't compete heavily.","rollback_reason":"regression of ~0.7s wall across 3 verification runs. The v8 watchdog thread DOES contend for cycles with the 16th rayon worker on a 16-core host once analyzer threads saturate. The previous 15-worker setting was correctly accounting for this; reverting to `num_cpus - 1`.","fingerprints":"10/10 match","session_state":"33 experiments, 14 keeps, 18 discards. Best 33.68s. Plateau remains at 33.6-33.7s.","lesson_learned":"the v8 watchdog interaction was REAL despite my earlier hypothesis. Always leave one core free for management threads on multi-threaded analyzers."}}
{"run":34,"commit":"c03deef","metric":33.16,"metrics":{"analyzer_seconds":28.525,"peak_rss_mb":1472,"user_cpu_seconds":362.64,"sys_cpu_seconds":33.97,"violations":18545,"build_seconds":0.49},"status":"keep","description":"Replace per-pattern glob iteration in get_files with a single GlobSet for ignore + only patterns. Discovered via instrumentation: path filtering was ~17s CPU during file walk (~1s wall) because each entry iterated ~135 patterns sequentially. GlobSet bulk matches all patterns in one SIMD-optimized pass.","timestamp":1777755429333,"segment":0,"confidence":10.659335288367547,"asi":{"hypothesis":"instrumentation showed path_filter takes 17s CPU summed across walk_subtree calls (single subtree at 0.94s for cloud_platform). PathPattern.matches iterated ~135 ignore patterns per dirEntry; ~272k entries × 135 patterns × ~500ns/pattern ≈ 17s CPU. A single GlobSet match is ~300ns regardless of pattern count.","delta_vs_prev_best_s":-0.46,"delta_vs_baseline_s":-218.09,"pct_vs_baseline":-86.81,"delta_user_cpu_s":-7.27,"delta_peak_rss_mb":55,"fingerprints":"10/10 match","verification_runs":"3 back-to-back: 33.41 / 33.10 / 33.16, mean 33.22 (vs prev plateau mean 33.66, spread 0.31).","implementation":"added build_path_glob_set() helper in cli/src/file_utils.rs that compiles a list of PathPatterns into a GlobSet. In get_files, build the ignore + only GlobSets once at function entry, then use them inside walk_subtree. Prefix-based matching (PathPattern.prefix) is preserved as a separate fallback. Required adding `globset = \"0.4.16\"` as a direct dep on the cli crate (already a transitive dep via kernel, so binary size unchanged).","scope_check":"this is a generally-useful optimization: any analyzer scan with many ignore patterns (gitignore + DEFAULT_IGNORED_GLOBS + custom ignore) benefits, not just dd-source. Larger repos with longer pattern lists would benefit even more.","lesson_repeated":"instrumentation reveals hotspots that micro-optimization speculation misses. Spent 7+ iterations trying to push past the 33.6s plateau before adding fine-grained timing inside walk_subtree."}}
{"run":35,"commit":"c5e0336","metric":32.5,"metrics":{"analyzer_seconds":27.753,"peak_rss_mb":1403,"user_cpu_seconds":342.09,"sys_cpu_seconds":32.56,"violations":18545,"build_seconds":0.49},"status":"keep","description":"Reorder file-level pre-screen check: evaluate `pre_screen.matches(code)` BEFORE `rule_config.rule_is_enabled(name)` in the per-rule any() filter. The pre-screen is a cheap memchr-style content check; rule_is_enabled walks path_restrictions (HashMap + glob iteration). On dd-source most rules are config-enabled but many files trip pre_screen for SOME rules but not all — putting pre_screen first lets .any() short-circuit on the cheaper check, saving rule_is_enabled work for screen-rejected rules.","timestamp":1777755848064,"segment":0,"confidence":10.883084577114431,"asi":{"hypothesis":"instrumentation showed the file-level any() screen takes ~7s wall (~106s CPU summed across 15 threads). Per (file, rule): pre_screen first if cheaper, then rule_is_enabled.","delta_vs_prev_best_s":-0.66,"delta_vs_baseline_s":-218.75,"pct_vs_baseline":-87.07,"delta_user_cpu_s":-20.55,"delta_peak_rss_mb":-69,"fingerprints":"10/10 match","verification":"two runs at 32.63 / 32.50, mean 32.57. Highly stable.","implementation":"swap the AND order from `rule_is_enabled && pre_screen` to `pre_screen && rule_is_enabled`. .any() short-circuits at the first passing rule on the cheaper check.","instrumentation_methodology_paid_off_again":"third major win this session from instrumenting first then optimizing. Run #27 (file walking 13s→20s wall via instrumentation), run #34 (path filtering 17s→1s wall via GlobSet), run #35 (screen reorder 7s−6s wall via cheap-check-first). All discovered by adding fine-grained timers, not by speculating.","lesson":"after each major optimization, re-profile. Bottlenecks shift."}}
{"run":36,"commit":"670ea25","metric":29.81,"metrics":{"analyzer_seconds":25.229,"peak_rss_mb":1463,"user_cpu_seconds":317.73,"sys_cpu_seconds":32.92,"violations":18545,"build_seconds":0.47},"status":"keep","description":"Reorder per-rule loop in `analyze_with_combined`: check `buckets[rule_idx].is_empty()` BEFORE `rule_config.rule_is_enabled` and `pre_screen.matches(code)`. Bucket-empty is a Vec::is_empty() check (~ns), while the other two are HashMap+path-restriction work and content-scan work (~µs each). For most (file, rule) pairs the bucket IS empty (combined query produced no matches), so we skip 2 µs-scale checks per rule per parsed file.","timestamp":1777756271138,"segment":0,"confidence":11.627198739826724,"asi":{"hypothesis":"instrumentation showed per_rule loop ~113 s CPU summed (~7.5 s wall). Most (file, rule) pairs hit empty bucket; reordering bucket-check first lets us skip rule_is_enabled + pre_screen.matches calls for the common case.","delta_vs_prev_best_s":-2.69,"delta_vs_baseline_s":-221.44,"pct_vs_baseline":-88.13,"delta_user_cpu_s":-24.36,"delta_peak_rss_mb":60,"fingerprints":"10/10 match","verification":"two runs at 30.51 / 29.81, mean 30.16. Highly stable.","implementation":"swap the per-rule filter_map check order. Was: rule_is_enabled → pre_screen → bucket. Now: bucket → rule_is_enabled → pre_screen. Bucket check is essentially free; the other two are now only paid when a rule has matches in this file (~24 of 63 rules × some files).","instrumentation_methodology_now_5_for_5":"five instrumentation-driven wins this session (#27 walking, #34 path filter, #35 screen reorder, #36 [this one] per_rule reorder, plus run #28's CPU cap retest). Each profile run shifts the bottleneck and reveals the next.","lesson":"after each major win, RE-PROFILE. The per_rule loop reorder was a 1-line change that saved 25s CPU because bottlenecks shift after each optimization."}}
{"run":37,"commit":"670ea25","metric":31.61,"metrics":{"analyzer_seconds":26.77,"peak_rss_mb":1340,"user_cpu_seconds":334.23,"sys_cpu_seconds":32.57,"violations":18545,"build_seconds":0.49},"status":"discard","description":"Pre-filter matches at combined-query emit time using an eager `accept_rule: Vec&lt;bool&gt;` mask (pre_screen + rule_is_enabled per rule per file). Skips capture-Vec construction for matches of broad-pattern rules whose JS-mined literals reject the file. Discarded: 31.12 / 31.61 (mean 31.36) vs prev best 29.81 — +1.2s regression. The eager 63-rule mask construction (~17s CPU) outweighs the saved capture-Vec allocations. Same lesson as runs #9, #22, #24: eager precomputation loses to the lazy short-circuit.","timestamp":1777756801437,"segment":0,"confidence":12.852002321532208,"asi":{"hypothesis":"skipping capture-Vec construction for matches of pre_screen-rejected rules at combined-query emit time should save ms of work per file (especially for broad-pattern rules with many matches). Cost: 63 pre_screen evaluations × ~67k parsed files = ~4 s eager mask construction.","rollback_reason":"regression of ~1.2 s wall, +17 s user_cpu. The instrumented run misleadingly showed -1 s Duration improvement; non-instrumented benchmark shows the real picture. The eager mask construction (4M `pre_screen` + `rule_is_enabled` calls) dwarfs the savings from skipping capture-Vec construction. Same lesson as runs #9, #22, #24: eager precomputation loses to the lazy short-circuit.","fingerprints":"10/10 match — correctness preserved.","instrumentation_lesson":"instrumentation runs have their own perturbation overhead. ALWAYS verify with the actual benchmark workflow before declaring a win. The instrumented Duration was 24.9 s, but the actual benchmark showed 31 s wall — the difference between Duration and wall (5–6 s gap from dd-auth + sarif + ...) widened, suggesting the eager-mask path has subtle interactions with rayon thread-pool scheduling that don't show up in per-file timing.","next_action_hint":"the next genuine wins are likely in v8 dispatch (~83 s CPU) and combined query traversal (~103 s CPU), but both involve C/native code that's hard to optimize without bigger architectural changes. The methodology has produced 5-of-6 wins; this is the first instrumentation-driven discard."}}
{"run":38,"commit":"260dc9f","metric":29.16,"metrics":{"analyzer_seconds":24.594,"peak_rss_mb":1388,"user_cpu_seconds":309.4,"sys_cpu_seconds":32.56,"violations":18545,"build_seconds":0.47},"status":"keep","description":"Use `String::new()` for filename in screen-skipped / empty-bucket RuleResults instead of `filename.to_string()`. These RuleResults are dropped by the driver's `retain_mut` (violations is empty), so the filename String allocation is pure churn. ~270 MB of String allocs avoided across a dd-source-scale scan (4 callsites in analyze_with + analyze_with_combined emit empty RuleResults; the bucket-empty path is hit ~2.7M times).","timestamp":1777757097379,"segment":0,"confidence":12.804266359181321,"asi":{"hypothesis":"the empty-RuleResult emission path allocates a fresh filename String per (file, screen-skipped-rule) pair (~2.7M allocs), but retain_mut drops these RuleResults immediately. Setting filename = String::new() for these cases saves the alloc churn.","delta_vs_prev_best_s":-0.65,"delta_vs_baseline_s":-222.09,"pct_vs_baseline":-88.39,"delta_user_cpu_s":-8.33,"delta_peak_rss_mb":-75,"fingerprints":"10/10 match","verification":"two runs at 29.16 / 29.23, mean 29.20. Highly stable.","implementation":"4 callsites: analyze_with's screen-skip path; analyze_with_combined's bucket-empty / pre-screen-fail / matches.is_empty paths. Each was returning a RuleResult with `filename: filename.to_string()` only to have the driver drop it. Replaced with String::new(). The rule's per-file parse-time stat in `-x performance-statistics` output is now recorded under filename \"\" for these empties, but the user-facing fingerprint (SARIF output) is unchanged.","trade_off":"for `-x` runs, the slowest-parses heap accumulates `(\"\", parse_time)` entries which are slightly less informative. Acceptable since the heap is bounded to 100 entries and this is a debug-only feature. The benchmark itself doesn't exercise -x.","instrumentation_methodology_continues":"this win came from re-profiling after the previous iteration. The screen check kept dominating; looked at the per-rule loop's empty-result construction; saw String alloc per call; replaced with String::new()."}}
