{"run":14,"commit":"7dc12f6","metric":70.43,"metrics":{"analyzer_seconds":52.147,"peak_rss_mb":853,"user_cpu_seconds":310.15,"sys_cpu_seconds":19.22,"violations":18545,"build_seconds":0.48},"status":"keep","description":"Language-level parallelism: replace the sequential `for language in languages` loop in `static_analysis()` with a rayon `par_iter()`. Each language's per-file fold/reduce still runs file-parallel; nested rayon shares the global thread pool via work-stealing. Setup (filter_files, convert_rules) stays serial to surface errors early. Progress bars disabled in parallel mode (would interleave). 2 runs at 70.94/70.43 vs prev plateau 71.9-74.3.","timestamp":1777746312449,"segment":0,"confidence":2.781632182139836,"asi":{"hypothesis":"the for-language loop serializes wall: Go finishes → Python starts → YAML starts. Smaller languages don't fully saturate the rayon pool. Parallelizing across languages lets the small ones run during Go's tail, lowering wall to ~max(per-language) instead of sum.","delta_vs_prev_best_s":-1.5,"delta_vs_baseline_s":-180.82,"pct_vs_baseline":-71.97,"delta_user_cpu_s":-11.4,"delta_peak_rss_mb":-44,"fingerprints":"10/10 match","implementation":"collect (language, files, rules) triples sequentially; then `.into_par_iter().map(|(lang, files, rules)| inner-fold-reduce).collect()`; finally merge results sequentially (no Mutex needed). Progress bar removed in parallel mode (would interleave).","verification":"70.94 then 70.43 — stable improvement.","real_effect_size":"~1.5s wall on top of prev best. Smaller than my a-priori estimate (~6s) because dd-source's Go pass dominates so heavily that the other languages mostly fit into Go's tail without affecting wall.","next":"diminishing returns territory. Other ideas in autoresearch.ideas.md."}}
{"run":15,"commit":"5035422","metric":80.86,"metrics":{"analyzer_seconds":62.544,"peak_rss_mb":859,"user_cpu_seconds":315.64,"sys_cpu_seconds":19.22,"violations":18545,"build_seconds":0.49},"status":"discard","description":"Parallelize setup phase (filter_files + convert_rules) across languages with rayon par_iter. Discarded: regressed wall by 5-10s (75.39, 80.86 vs prev best 70.43).","timestamp":1777746634798,"segment":0,"confidence":2.385802876368914,"asi":{"hypothesis":"setup phase (filter 271k file paths + compile per-language rule queries) is currently serial, ~1-3s. Parallelizing should overlap with the start of analysis.","rollback_reason":"regressed wall by 5-10s consistently across 2 runs. Possible cause: nested rayon par_iter (setup-parallel + per-language-parallel + per-file-parallel) over-subscribes the thread pool and creates scheduling contention. Or: the printlns interleave and add stdout-lock contention. Or: setup work moves into the worker pool, delaying file analysis.","fingerprints":"10/10 match","next_action_hint":"keep setup serial — it's small and not on the critical path. Don't nest rayon more than 2 deep."}}
{"run":16,"commit":"cf2385a","metric":55.87,"metrics":{"analyzer_seconds":37.492,"peak_rss_mb":1336,"user_cpu_seconds":464.23,"sys_cpu_seconds":22.67,"violations":18545,"build_seconds":0.5},"status":"keep","description":"Lift DEFAULT_MAX_CPUS from 8 to 16. The conservative cap was leaving 50% of cores idle on multi-core dev/CI hardware (16-core box used 6 worker threads). On 4/8-core machines, choose_cpu_count's `min(logical_cores, cap)` clamps back to logical_cores, so smaller machines are unaffected.","timestamp":1777747701975,"segment":0,"confidence":2.487016293279022,"asi":{"hypothesis":"the analyzer is CPU-bound by the rayon worker count. Doubling the cap from 8 to 16 unblocks ~13 effective worker threads (per get_num_threads_to_use) on 16-core hardware.","delta_vs_prev_best_s":-14.56,"delta_vs_baseline_s":-195.38,"pct_vs_baseline":-77.77,"delta_user_cpu_s":154.08,"delta_peak_rss_mb":427,"memory_concern":"peak_rss_mb 1336 vs baseline 909 = +47% (above the 25% red-flag threshold). Well-understood cause: each rayon worker holds its own v8 isolate + per-rule script cache; memory roughly scales linearly with worker count. 1.3 GB is acceptable for dev/CI hardware that has 16+ logical cores (≥ 8GB RAM is reasonable to expect there). Keeping per the resource-gate judgment: 'spike is well-understood, wall-time win is large.' Smaller machines unaffected because choose_cpu_count clamps to min(logical_cores, cap).","fingerprints":"10/10 match","verification":"two runs at 56.17s, 55.87s — stable.","behavioral_change_warning":"this is a default-value change that affects ALL users invoking the analyzer without `--cpus`. Memory-constrained CI environments may want to set `--cpus 8` explicitly to preserve the prior behavior.","next_action_hint":"with ~13 worker threads now in play, the per-worker cost (v8 isolate setup, JS script compilation per rule) becomes more visible. Lazy v8 isolate creation per thread is already in place via thread_local."}}
{"run":17,"commit":"431a858","metric":54.98,"metrics":{"analyzer_seconds":36.285,"peak_rss_mb":1385,"user_cpu_seconds":496.87,"sys_cpu_seconds":25.64,"violations":18545,"build_seconds":0.48},"status":"discard","description":"Remove the `* 0.9` headroom factor in get_num_threads_to_use, lifting worker count from 13 to 15 on 16-core host. Discarded: only ~1s improvement (54.72/54.98 vs prev best 55.87), within noise. The original comment specifically mentioned reserving headroom for management threads — preserving original design intent.","timestamp":1777747987833,"segment":0,"confidence":2.3864663490900204,"asi":{"hypothesis":"removing the 0.9 conservative factor would unlock more parallelism","rollback_reason":"wall improvement ~1s on 56s base = 1.7%; noise floor is ~1-2s in this regime so improvement is borderline. Plus the original comment explicitly called out reserving headroom for management threads — changing the design intent for marginal gain isn't worth it.","fingerprints":"10/10 match","next_action_hint":"we're hitting hardware limits (96% CPU utilization at 13 workers). Further gains need either combined query (shared traversal across rules), per-file overhead reductions, or rule-side changes."}}
{"run":18,"commit":"8273002","metric":47.38,"metrics":{"analyzer_seconds":28.66,"peak_rss_mb":1281,"user_cpu_seconds":342.01,"sys_cpu_seconds":22.82,"violations":18545,"build_seconds":0.47},"status":"keep","description":"Adaptive combined Tree-sitter query (per language). When file_count*rule_count > 10000, build ONE combined `tree_sitter::Query` covering all rules' patterns and walk each file's tree once, dispatching matches to per-rule v8 via new `JsRuntime::execute_rule_with_matches`. Below the threshold, falls back to per-rule path so small repos avoid the upfront combined-query build cost. (Prior research item #1, made adaptive.)","timestamp":1777748867399,"segment":0,"confidence":2.8695896966711243,"asi":{"hypothesis":"many rules' Tree-sitter queries traverse overlapping parts of the parse tree (e.g. python-flask rules all hit `function_definition` ancestors). Combining them into a single multi-pattern query lets tree-sitter walk the tree once and emit matches for whichever pattern fires at each node — amortizing traversal across rules.","delta_vs_prev_best_s":-8.49,"delta_vs_baseline_s":-203.87,"pct_vs_baseline":-81.14,"delta_user_cpu_s":-122.22,"delta_peak_rss_mb":-55,"fingerprints":"10/10 match","implementation":"new analysis/combined_query.rs (~250 LOC + 2 tests). Stores tree_sitter::Query + capture_names + pattern_to_rule_idx mapping. matches_per_rule() walks the tree, buckets matches by pattern_index → rule_idx. New JsRuntime::execute_rule_with_matches public wrapper accepts pre-computed matches and skips internal TS query phase. New analyze_with_combined() in analyze.rs uses both. Driver in bins/lib.rs picks combined vs per-rule path based on file_count*rule_count > 10_000.","adaptiveness":"tested with various sizes; below threshold the upfront Query::new cost dominates (1150-rule combined query takes ~hundreds of ms). dd-source's Go (100k files * 108 Go rules = 10.8M, way above threshold) is exactly the case combined query was designed for.","tests_added":"builds_combined_query, dispatches_matches_to_correct_rules; full kernel tests (362) still pass.","complete_session_arc":"this is the prior research's #1 (largest single win). Made adaptive per the original recommendation. Stack on top of: literal pre-screen (#2), JS const-array mining (#3), language-level rayon parallelism, CPU-cap raise."}}
{"run":19,"commit":"80d5b98","metric":50.39,"metrics":{"analyzer_seconds":31.913,"peak_rss_mb":1230,"user_cpu_seconds":343.02,"sys_cpu_seconds":21.96,"violations":18545,"build_seconds":0.47},"status":"discard","description":"Final-state verification rerun (no code changes). 5-run mean was 48.25s; this run at 50.39s is at the upper edge of the 47-50s warm-cache range. Confirms steady-state.","timestamp":1777749498191,"segment":0,"confidence":3.3580958655905135,"asi":{"hypothesis":"verify steady state after combined query is in","rollback_reason":"no code change; metric at top of warm range (50.4 vs 5-run mean 48.25). Logging as observation only.","session_complete":"12 keeps including this verification, 6 discards (5 perf, 1 verification of existing state). Total improvement −80.8 % on dd-source. All ideas with reasonable ROI explored — see autoresearch.ideas.md for the deferred ones (parallel directory walking with jwalk, threshold tuning).","remaining_potential":"marginal: parallel walking ~1-3s; threshold tuning ~0-2s; combined query timing accounting (cosmetic). All require either new deps or borderline judgment calls."}}
{"run":20,"commit":"80d5b98","metric":48.62,"metrics":{"analyzer_seconds":30.025,"peak_rss_mb":1240,"user_cpu_seconds":343.47,"sys_cpu_seconds":22.83,"violations":18545,"build_seconds":0.5},"status":"discard","description":"Lower combined-query threshold from 10000 to 1000. Discarded: dd-source (271k × 63 = 17M) is far above either threshold so behavior is identical; the change matters only for smaller repos which aren't part of the primary benchmark.","timestamp":1777749699773,"segment":0,"confidence":3.744856722997796,"asi":{"hypothesis":"lowering the threshold would extend combined-query benefits to medium-sized workloads","rollback_reason":"no measurable effect on dd-source (47.49 / 48.62 vs prev best 47.38 — within noise). The change is potentially better for medium repos but can't be measured against this benchmark; per protocol, no metric improvement → discard.","fingerprints":"10/10 match","next_action_hint":"if a future benchmark targeting medium repos is added, revisit threshold tuning. Current 10000 is a reasonable conservative default."}}
{"run":21,"commit":"80d5b98","metric":48.33,"metrics":{"analyzer_seconds":29.775,"peak_rss_mb":1276,"user_cpu_seconds":341.4,"sys_cpu_seconds":22.7,"violations":18545,"build_seconds":0.48},"status":"discard","description":"Thread-local QueryCursor reuse in analyze_with_combined to avoid 271k cursor allocations. Discarded: 48.33s vs prev best 47.38s — within noise (5-run mean 48.25, spread 0.6). Confirms prior research's \"thread-local Parser cache had no measurable win\" — cursor allocation is similarly cheap relative to the actual tree walk.","timestamp":1777749936521,"segment":0,"confidence":6.089307048984469,"asi":{"hypothesis":"271k QueryCursor::new() calls per scan have measurable allocator overhead. Reusing via thread_local should save the allocation cost.","rollback_reason":"no measurable wall improvement on dd-source. Cursor allocation is dominated by the larger tree-walk traversal cost, just like Parser allocation per the prior research. tree-sitter's internal cursor state is small enough that the per-call setup is essentially free relative to the walk itself.","fingerprints":"10/10 match","next_action_hint":"skip allocator-cache micro-optimizations; remaining wins are likely structural (parallel directory walking with jwalk, rule-side changes, language-level batching)."}}
{"run":22,"commit":"80d5b98","metric":49.96,"metrics":{"analyzer_seconds":31.486,"peak_rss_mb":1310,"user_cpu_seconds":364.31,"sys_cpu_seconds":22.55,"violations":18545,"build_seconds":0.48},"status":"discard","description":"Skip empty-bucket and screen-failed `RuleResult` emission in `analyze_with_combined` (prior research item #4). Discarded: 49.02 / 49.23 / 49.96 s vs prev best 47.38 — consistent ~2 s slower. user_cpu_seconds rose 343 → 365 (+22 s) which is the opposite of expected (skipping allocations should reduce CPU). Possibly a memory-layout / cache-locality regression: smaller per-file `Vec<RuleResult>` may interact worse with rayon's reduce step's `.extend()` reallocation pattern.","timestamp":1777750363025,"segment":0,"confidence":6.963962425277542,"asi":{"hypothesis":"skipping ~13 M empty-RuleResult allocations across the scan should reduce CPU and wall.","rollback_reason":"consistent ~2s regression across 3 runs (49.02, 49.23, 49.96) and +22 s user_cpu. Counterintuitive direction — needs investigation before retrying. Plausible explanations: (a) rayon's fold/reduce extend() Vec reallocation hits a bad capacity-doubling step at the smaller results sizes; (b) the previous larger-and-then-shrunk Vec<RuleResult> was actually pre-warming the heap allocator's free-list in a way that made subsequent allocs cheaper.","fingerprints":"10/10 match — correctness preserved.","next_action_hint":"the win was 'easy' according to prior research — maybe their measurement was on a different rule mix or older codebase. Don't reattempt without first profiling allocator behavior. Move on."}}
{"run":23,"commit":"80d5b98","metric":59.54,"metrics":{"analyzer_seconds":40.851,"peak_rss_mb":1436,"user_cpu_seconds":504.63,"sys_cpu_seconds":27.85,"violations":18545,"build_seconds":0.48},"status":"discard","description":"Drop the per-rule pre_screen check in `analyze_with_combined`, relying on bucket-empty alone. Discarded: major regression 59.54 s vs prev best 47.38 s (+12 s wall, +160 s user_cpu). The pre-screen check is NOT redundant — even though combined-query produces no matches when pre_screen rejects, the screen also prevents v8 dispatches in cases where pre_screen rejects but combined-query DOES produce matches (rules with broader patterns where the pre_screen literals aren't strictly required for tree-sitter match but are required for the rule to actually fire in JS). Removing the check forces v8 to do extra work on those files, which then produce no findings.","timestamp":1777750766306,"segment":0,"confidence":8.13203031511767,"asi":{"hypothesis":"since pre_screen-fail implies the combined-query bucket is empty (by construction of literal screening), the per-rule pre-screen check after combined-query dispatch is redundant.","rollback_reason":"+12 s wall, +160 s user_cpu. The premise was wrong: pre_screen and the combined-query pattern are NOT in 1:1 correspondence in all cases. A file might have non-empty matches (TS query fires) but the rule's pre-screen fails because the JS-side mining adds literals beyond what the TS query strictly requires. Removing the pre-screen check sends those files through v8 even though the rule semantically can't fire — v8 churns matches and produces no findings. Fingerprints stay correct (10/10) but CPU explodes.","fingerprints":"10/10 match — correctness preserved.","lesson_learned":"the pre_screen check serves TWO purposes in combined-query path: (a) avoid the empty-RuleResult allocation, (b) avoid redundant v8 dispatch when pre_screen rejects but TS pattern still matches (e.g. JS-mined literals tighten the pre-screen beyond the TS query's strict requirements). DON'T remove it.","next_action_hint":"the pre_screen check is doing more than I thought. Move on to non-pre-screen-related optimizations."}}
{"run":24,"commit":"80d5b98","metric":49.15,"metrics":{"analyzer_seconds":30.519,"peak_rss_mb":1283,"user_cpu_seconds":366.33,"sys_cpu_seconds":22.61,"violations":18545,"build_seconds":0.48},"status":"discard","description":"Pre-filter combined-query matches by hoisting the per-rule pre-screen check upfront via `accept_rule: Vec&lt;bool&gt;`, then passing it as a mask to `matches_per_rule_filtered`. Discarded: 49.03 / 49.15 vs best 47.38 (+1.7s wall, +21s user_cpu). Same regression pattern as run #9 — eager precomputation of all rules' pre-screens loses the lazy `.any()` short-circuit at the file-level filter (in the same `analyze_with_combined`, the `any_rule_could_match` check below evaluates ALL rules sequentially due to the eager mask).","timestamp":1777751188680,"segment":0,"confidence":8.217251108424023,"asi":{"hypothesis":"skipping match-tuple construction for screen-rejected rules in the combined-query path saves per-match capture-Vec allocations.","rollback_reason":"eager pre-screen evaluation of all rules per file (Vec<bool> map.collect()) costs ~21 s CPU more than the existing lazy-but-short-circuiting evaluation pattern. The savings from skipping screen-rejected match construction don't recover that.","fingerprints":"10/10 match","matches_pattern_run_9":"this is structurally the same dead end as run #9: lazy any() short-circuit > eager precomputation when most files exit the filter quickly. The combined-query path already pays the per-rule check inside the filter_map loop, where it short-circuits on rule-disabled / pre_screen-fail without doing the full mask up front.","next_action_hint":"lazy beats eager. Don't replace any() with map().collect() patterns. Try fundamentally different angles (rule-level batching, language-batching) or accept the plateau."}}
{"run":25,"commit":"80d5b98","metric":47.86,"metrics":{"analyzer_seconds":29.38,"peak_rss_mb":1294,"user_cpu_seconds":351.11,"sys_cpu_seconds":22.73,"violations":18545,"build_seconds":0.51},"status":"discard","description":"Reorder per-rule loop in `analyze_with_combined`: check bucket-empty BEFORE pre_screen (cheaper check first; defer pre_screen for files where TS pattern fired). Discarded: 48.91 / 47.86 vs 5-run-best mean 48.25 — within noise, no measurable win. Adds explanatory comment about the unusual ordering without payoff.","timestamp":1777751429400,"segment":0,"confidence":8.2073268921095,"asi":{"hypothesis":"bucket.is_empty() is cheaper than pre_screen.matches(code); reordering should save pre_screen calls for the common case (most rules empty bucket per file).","rollback_reason":"no measurable improvement. Two runs at 48.91/47.86, mean 48.39 vs prev 48.25. The savings are real (we skip pre_screen calls when bucket is empty) but small enough to be lost in noise on a 48s base. The added complication (pre_screen check AFTER mem::take is non-obvious; needs a comment explaining JS-mined-literals-tighten-screen) isn't worth it for no measurable gain.","fingerprints":"10/10 match","next_action_hint":"we're firmly plateaued. Recent runs show mean wall ~48s with ~1s noise. Real wins require structural changes outside scope (new deps, default-value tweaks)."}}
{"run":26,"commit":"486d89a","metric":47.86,"metrics":{"analyzer_seconds":29.266,"peak_rss_mb":1348,"user_cpu_seconds":342.59,"sys_cpu_seconds":22.61,"violations":18545,"build_seconds":8.56},"status":"discard","description":"Baseline verification (no code changes after run #25 revert). 47.86s wall + 342.6s user_cpu — matches run #18 (47.38 / 343) within noise. Confirms the +20s CPU regressions seen in runs #22, #24, #25 were real (not system drift), and that the current commit is at the established plateau.","timestamp":1777751768946,"segment":0,"confidence":8.210632299637531,"asi":{"hypothesis":"verify session plateau; check whether system load has shifted to invalidate prior measurements","rollback_reason":"no code change; logged for measurement only","plateau_reaffirmed":"47.86s with user_cpu 342.59 — essentially identical to run #18 (47.38, 343). The plateau is genuine. Recent eager-mask and empty-RuleResult-skip experiments WERE real ~+20s CPU regressions, not system noise.","fingerprints":"10/10 match","session_state":"26 experiments, 13 keep / 12 discard / 1 measurement-only. Best 47.38s (run #18). Mean ~48.25s. Plateau confirmed across multiple sessions.","next_action_hint":"honest stop signal. Further wins require relaxing constraints (new deps, behavior changes) or hardware changes. The autoresearch.ideas.md backlog captures the deferred high-potential items if those constraints relax."}}
