{"run":49,"commit":"f99f2ab","metric":25.84,"metrics":{"analyzer_seconds":21.957,"peak_rss_mb":1390,"user_cpu_seconds":261.89,"sys_cpu_seconds":31.53,"violations":18545,"build_seconds":0.48},"status":"discard","description":"Lazy pre-screen filter at combined-query emit time. Added `matches_per_rule_with_filter` that takes an `accept_rule(rule_idx) -> bool` predicate, evaluated lazily on first match per rule per file (cached after). On rejection, drops that rule's matches at the source — saves the per-match capture-Vec allocation. Differs from run #37 (which evaluated the predicate eagerly for ALL rules upfront). Discarded: 4 runs at 25.99 / 25.47 / 24.58 / 25.84 (mean 25.47) vs prev best mean 25.23 — wall is +0.24 s slightly worse on mean despite user_cpu dropping ~5 s consistently (263 vs 268). Single best run (24.58) is below prev best (24.79) by 0.21 s but isn't reproducible enough to claim. Same pattern as run #39: real CPU savings that don't translate to wall.","timestamp":1777762168148,"segment":0,"confidence":12.395183360700603,"asi":{"hypothesis":"Lazy (vs eager run #37) pre-screen filter at combined-query emit time would save the capture-Vec allocation cost for matches whose rule's pre_screen rejects the file, without paying for the eager evaluation cost over inactive rules. Estimated savings: ~30s CPU = ~2s wall.","rollback_reason":"wall mean is essentially unchanged (25.47 vs 25.23 prev best mean = +0.24 s within noise); single best run (24.58) is borderline below prev best (24.79). user_cpu DID drop consistently ~5s (-1.8%) across 4 runs which is real CPU savings, but doesn't translate to wall. Likely because the saved work (capture-Vec construction) was already happening on threads with idle CPU, not on the critical path — the bottleneck is something else (probably tree-sitter native traversal time, which is unaffected).","next_action_hint":"stop chasing per-(file, rule) allocation savings — they're not the wall bottleneck. The genuine wall consumers are native code: tree-sitter parse + combined query traversal + v8 dispatch. Pure Rust micro-opts don't move them.","fingerprints":"10/10 deep check pass.","lesson_learned":"user_cpu and wall_seconds aren't always proportional. CPU savings on non-critical-path work — i.e. work that fills idle worker time but doesn't extend the longest task — don't show up in wall. Rayon's work-stealing makes the critical path = max-length task, not sum/N."}}
{"run":50,"commit":"f99f2ab","metric":24.91,"metrics":{"analyzer_seconds":21.036,"peak_rss_mb":1326,"user_cpu_seconds":267.97,"sys_cpu_seconds":31.63,"violations":18545,"build_seconds":9.21},"status":"discard","description":"Stability verification on current best commit (no code changes). 24.91 s vs prev best 24.79 — within 0.12 s, essentially reproducing the run-#44 best. user_cpu 267.97, analyzer_seconds 21.04 \\u2014 all match the established run #44 baseline. Confirms (a) the 24.8-25.5 s plateau is genuine and (b) the recent regressions (FxHash #47, LTO #46, lazy-mask-mean #49) were real, not system drift.","timestamp":1777762334952,"segment":0,"confidence":12.247701460248784,"asi":{"hypothesis":"verify steady state on the current best after the streak of discards (#45-#49) — confirm system is healthy and plateau is real.","result":"yes — 24.91 s wall (within 0.12 s of 24.79 best). All secondary metrics match the established run #44 baseline. The plateau is genuinely at 24.8-25.5 s.","rollback_reason":"no code change; benchmark in established range.","next_action_hint":"the wall floor is being reached. Remaining bottlenecks are native code paths: tree-sitter parse (~5.5 s wall), combined query traversal (~6.9 s wall), v8 dispatch (~5 s wall), v8 init (~1-2 s, locked to main thread). To go meaningfully lower would require: (a) PGO, (b) splitting combined query by literal cluster (substantial restructure, uncertain payoff), (c) accepting the plateau."}}
{"run":51,"commit":"405fced","metric":24.87,"metrics":{"analyzer_seconds":21.063,"peak_rss_mb":1380,"user_cpu_seconds":269.26,"sys_cpu_seconds":32.08,"violations":18545,"build_seconds":0.49},"status":"keep","description":"Set `.with_min_len(8)` on the per-file rayon par_iter inside each language. With 271k+ small tasks (avg ~600 µs per file), default rayon dynamic chunking can over-split work and inflate scheduling overhead. Min length 8 keeps small-batch granularity for big-file load balancing while reducing the per-task work-stealing cost. Three runs at 25.01 / 24.87 / 25.00 (mean 24.96, std dev 0.07) vs prev best mean 25.23 (std dev ~0.5) → mean -0.27 s, variance dramatically tighter, worst-case -0.84 s vs prev worst.","timestamp":1777762597273,"segment":0,"confidence":12.337782620539361,"asi":{"hypothesis":"rayon par_iter on 271k tiny tasks (avg ~600 µs/file) over-splits into too-fine chunks at the worker boundary, inflating scheduling overhead. with_min_len(8) sets a minimum chunk size that smooths out per-task overhead while still allowing big-file balance via stealing.","result":"mean improved from 25.23 to 24.96 (-0.27 s) AND variance collapsed from std dev ~0.5 to ~0.07. Worst-case run improved from 25.85 to 25.01 (-0.84 s), suggesting the prior 'unlucky' runs were genuinely losing time to scheduling overhead. user_cpu unchanged (267-269 s) so this is pure scheduling efficiency, not algorithmic.","fingerprints":"10/10 deep check pass.","tradeoff":"min_len=8 means a worker holds at least 8 files even if one is huge — in theory, this could prevent stealing for the tail. In practice, dd-source's longest single-file work is a few ms (much less than 8 × 600 µs = 5 ms), so the chunk of 8 isn't a big enough granularity to cause tail issues.","lesson_learned":"for very-fine-grained rayon work (µs-level per-task), scheduling overhead becomes nontrivial. with_min_len is the standard knob; tune by experiment. Variance reduction is a genuine win even when mean barely moves — it makes the system more predictable in CI."}}
{"run":52,"commit":"405fced","metric":26.28,"metrics":{"analyzer_seconds":22.298,"peak_rss_mb":1421,"user_cpu_seconds":266.78,"sys_cpu_seconds":31.83,"violations":18545,"build_seconds":0.47},"status":"discard","description":"Apply `with_min_len(8)` to `filter_files_by_size` par_iter (mirroring run #51's success on the per-file analysis loop). Discarded: 26.44 / 26.28 (mean 26.36) vs prev best mean 24.96 = +1.4 s wall regression. user_cpu is actually DOWN (-2.5 s) but wall is up — the chunking apparently hurts more than it helps for this specific workload (per-file fs::metadata syscall is so cheap that even 8-file chunks add measurable per-chunk overhead, or the chunking interferes with kernel-level readahead).","timestamp":1777773279483,"segment":0,"confidence":12.42919868276619,"asi":{"hypothesis":"the same with_min_len(8) lesson from run #51 (per-file analysis loop) should apply to filter_files_by_size, which has 271k tiny fs::metadata-stat tasks.","rollback_reason":"+1.4 s wall regression across 2 runs. The two workloads differ: analysis-loop tasks are CPU-bound (~600 µs each, well-suited to chunking), while filter_files_by_size is syscall/IO-bound (~few µs each, dominated by kernel context-switching and disk readahead patterns that rayon's adaptive scheduling already optimizes for). Forcing chunks of 8 prevents rayon from spreading work across all workers immediately, leading to load imbalance.","next_action_hint":"with_min_len is workload-specific. Don't blanket-apply. The per-file CPU work in lib.rs gained from it; the syscall-bound filter doesn't. Skip this idea elsewhere unless the per-task time is in the CPU-bound µs range.","lesson_learned":"scheduling heuristics that help one phase can hurt another even when both look like 'lots of tiny tasks'. The distinguishing factor is what dominates the per-task time: CPU work (chunking helps) vs syscall/IO (chunking can hurt by serializing within a chunk while kernel readahead would have benefited from interleaving)."}}
{"run":53,"commit":"405fced","metric":25.19,"metrics":{"analyzer_seconds":21.214,"peak_rss_mb":1311,"user_cpu_seconds":267.94,"sys_cpu_seconds":31.87,"violations":18545,"build_seconds":0.48},"status":"discard","description":"Try `.with_min_len(4)` instead of 8 on the per-file analysis loop. Discarded: 26.32 / 25.19 (mean 25.76) vs prev best mean 24.96 = +0.8 s wall regression. Smaller chunk size means more scheduling overhead; 8 is the better local optimum.","timestamp":1777773486688,"segment":0,"confidence":15.484444444444447,"asi":{"hypothesis":"min_len=4 might preserve big-file load balance better than 8 while still tightening variance.","rollback_reason":"+0.8 s regression. Smaller chunk = more scheduling overhead. min_len=8 (run #51) is the local optimum.","next_action_hint":"skip further min_len tuning. 8 is the right value for this workload. Don't try 16, 32, etc. without strong reason — too-big chunks would prevent load-balance for the tail."}}
{"run":54,"commit":"405fced","metric":25.88,"metrics":{"analyzer_seconds":21.98,"peak_rss_mb":1316,"user_cpu_seconds":271.47,"sys_cpu_seconds":31.79,"violations":18545,"build_seconds":0.53},"status":"discard","description":"Replace `filter_files_for_language` per-language loop with a single `get_language_for_file` partition pass. Discarded: 25.88 s vs prev best mean 24.96 = +0.9 s wall regression, +2 s user_cpu. Root cause: `get_language_for_file` allocates a fresh `Vec<String>` of extensions per language per file (~30 langs × 271k files = ~8M allocs), because `match_extension` takes `&[String]` and the language constants are `&[&'static str]`. The original `filter_files_for_language` allocated those Vec<String>s ONCE per language (5 total), so it was cheaper despite scanning all files per language. The right optimization is to fix `match_extension`/`get_language_for_file` to avoid those allocations \\u2014 then partition once. Deferring that as it's a bigger refactor.","timestamp":1777773652666,"segment":0,"confidence":21.184284377923298,"asi":{"hypothesis":"Partition files by language ONCE instead of iterating all 271k files per language (n_languages * n_files passes). Save ~few hundred ms wall.","rollback_reason":"+0.9 s wall regression. `get_language_for_file` is implemented in a way that allocates Vec<String> of extensions per (language, file) pair via `extensions.to_vec().iter().map(|x| x.to_string()).collect::<Vec<String>>()`. With ~30 languages × 271k files = ~8M unnecessary allocations. The original per-language loop only paid this cost ONCE per language (5 total), so it was cheaper.","next_action_hint":"to make this work, FIRST refactor match_extension/match_exact_filename/match_prefix_filename to take &[&str] (or `impl Iterator<Item=&str>`) and avoid the .to_string().to_lowercase() per call. THEN partition once. Estimated savings after fix: 500 ms-1 s wall. Defer to ideas backlog as a substantial CLI refactor.","lesson_learned":"ALWAYS profile/inspect helper functions before assuming a 'cleaner' rewrite is faster. The function I called per-file was internally O(n_languages) with allocations, not O(1)."}}
{"run":55,"commit":"405fced","metric":26.31,"metrics":{"analyzer_seconds":22.384,"peak_rss_mb":1381,"user_cpu_seconds":267.84,"sys_cpu_seconds":32.19,"violations":18545,"build_seconds":0.47},"status":"discard","description":"Single-pass file partition by language (using alloc-free `match_extension_str` / `match_exact_filename_str` helpers), replacing the n_languages * n_files `filter_files_for_language` loop. Discarded: 26.20 / 26.31 (mean 26.26) vs prev best mean 24.96 = +1.3 s wall regression. Even with allocation-free helpers, `get_language_for_file` checks ~30 languages per file (it doesn't know which subset is \"relevant\" to the active rules), whereas the per-language filter loop only checks the ~5 active languages per file. So my approach does ~6x more comparison work per file. analyzer_seconds 22.28 (vs prev 21.06) confirms the slowdown is in the partition phase itself. The \"obvious\" partition optimization is actually the wrong shape; need to pass the relevant-languages set down so we can early-exit.","timestamp":1777773912416,"segment":0,"confidence":21.701964542405367,"asi":{"hypothesis":"Replace n_languages * n_files filter passes with a single partition pass; combined with alloc-free match_*_str helpers, save ~few hundred ms wall.","rollback_reason":"+1.3 s wall regression. Root cause: get_language_for_file iterates ALL ~30 supported languages per file. The per-language filter loop iterates only the ~5 languages relevant to the configured rules. So the partition does ~6x more per-file comparison work than the loop, more than offsetting the redundant-iteration savings.","next_action_hint":"if pursued: pass `relevant_languages: &HashSet<Language>` to get_language_for_file so it can skip irrelevant languages. Or build a `extension -> language` reverse map at startup (alloc-free O(1) lookup per file). Both are non-trivial refactors. Defer.","lesson_learned":"always check what 'helper' functions actually do BEFORE rewriting a hot path around them. get_language_for_file scales with all-supported-languages, not with active-languages."}}
{"run":56,"commit":"405fced","metric":25.1,"metrics":{"analyzer_seconds":21.149,"peak_rss_mb":1357,"user_cpu_seconds":267.92,"sys_cpu_seconds":32.15,"violations":18545,"build_seconds":0.47},"status":"discard","description":"Reverse-index file partition: build `HashMap<&'static str, Language>` from rule-relevant languages' extension/exact-name lists, partition files in O(1) HashMap lookup per file. Combined with new alloc-free `*_static` helpers. Discarded: 24.83 / 25.43 / 25.10 (mean 25.12) vs prev best mean 24.96 = +0.16 s mean (essentially noise-level), best tied at 24.83 vs 24.87. Variance increased (0.6 spread vs 0.14 prev). The optimization is theoretically faster (O(1) lookup vs filter loop) but doesn't measurably move the wall — the per-language filter loop was already cheap relative to the analyzer hotpath, and HashMap construction + lookup overhead nearly cancels the savings.","timestamp":1777774173720,"segment":0,"confidence":22.24557956777997,"asi":{"hypothesis":"Reverse-index O(1) lookup beats per-language filter loop, especially when extensions tables are static and HashMap is built from rule-relevant languages only.","rollback_reason":"+0.16 s mean wall regression. The per-language filter loop is too cheap to be a meaningful optimization target — it's iterating PathBufs and doing string compares which is already fast. HashMap construction + per-file Option chain has its own overhead. Net wash or slight loss.","next_action_hint":"the language filter is not the right lever; total cost is well below 1s wall. Further wins must come from the actual analyzer hotpath (parse, combined query, v8). All native code, hard to optimize from Rust.","lesson_learned":"theoretical complexity wins (O(n) -> O(1)) don't always materialize when constants matter and the original wasn't actually slow. Always measure first."}}
{"run":57,"commit":"405fced","metric":26.08,"metrics":{"analyzer_seconds":22.149,"peak_rss_mb":1380,"user_cpu_seconds":268.3,"sys_cpu_seconds":30.84,"violations":18545,"build_seconds":0.49},"status":"discard","description":"Force `AhoCorasickKind::DFA` for the literal-index automaton (was Auto, which selects NFA-contiguous for our pattern set). Discarded: 25.04 / 26.45 / 26.08 (mean 25.86) vs prev best mean 24.96 = +0.9 s wall regression. DFA's larger state table (per-state × alphabet 256) likely has worse L1/L2 cache behavior than the more compact NFA-contiguous representation for our ~few-hundred-literal pattern set. The default Auto selection is appropriate for this workload.","timestamp":1777774392899,"segment":0,"confidence":22.477419354838705,"asi":{"hypothesis":"DFA mode for AC is faster than NFA for small pattern sets.","rollback_reason":"+0.9 s wall regression. The DFA state table (256 * states bytes) doesn't fit cache as well as NFA-contiguous, and the per-byte transition cost difference is small enough that cache locality dominates for our ~3-15 character literals scanned over ~10-100 KB files.","next_action_hint":"leave AC kind on Auto (default). The crate's heuristic is right for this workload."}}
{"run":58,"commit":"baaa8ce","metric":23.44,"metrics":{"analyzer_seconds":19.63,"peak_rss_mb":1381,"user_cpu_seconds":262.32,"sys_cpu_seconds":30.11,"violations":18545,"build_seconds":0.51},"status":"keep","description":"Parallelize per-language setup (filter_files_for_language + convert_rules_to_rules_internal + CombinedQuery::try_new + LiteralIndex::build) via rayon `par_iter`. Each language's setup work is independent, and the combined-query + AC-index builds are now substantial enough to benefit (~tens to hundreds of ms each). Setup runs on the global rayon pool (already initialized in main before this point), and completes BEFORE the per-file analysis par_iter so there's no nesting. Five runs at 25.78 / 24.38 / 24.68 / 23.44 / 24.34 (mean 24.52, best 23.44) vs prev best mean 24.96 (best 24.87) → mean -0.44 s, best -1.43 s. analyzer_seconds dropped from ~21.06 mean to ~20.55, user_cpu trended slightly down (267 → 264 mean). 10/10 fingerprints match. NB: run #16 previously tried this (then-trivial setup) and discarded; the codebase has since added much heavier setup work (combined query + AC index) which made re-trying worth it.","timestamp":1777774749883,"segment":0,"confidence":22.758241758241756,"asi":{"hypothesis":"with combined-query and AC-index builds added since run #16, per-language setup work is no longer trivial. Parallelizing setup across languages should overlap their build times — max(per-language) instead of sum.","result":"mean -0.44 s wall, best -1.43 s wall. analyzer_seconds dropped from 21.06 to ~20.55 mean. user_cpu down ~3-5 s, suggesting some redundant work was eliminated (each language no longer waits for previous to finish before its setup begins).","fingerprints":"10/10 deep check pass.","lesson_learned":"old discards aren't permanent. As the codebase grows new heavy work, previously-rejected parallelization patterns can become wins. Re-test old discards periodically when the surrounding code changes. Run #16's setup was just `filter_files_for_language + convert_rules_to_rules_internal` — fast enough that the par_iter overhead exceeded savings. After AC + combined-query were added (runs #19, #43), setup is much heavier and parallelizing pays off.","deferred":"could go even further by pipelining setup with file walk + rule fetch (PHASE 3 in main) but that requires moving setup OUT of static_analysis() which is a bigger refactor."}}
