{"run":39,"commit":"260dc9f","metric":29.87,"metrics":{"analyzer_seconds":25.274,"peak_rss_mb":1364,"user_cpu_seconds":306.9,"sys_cpu_seconds":32.46,"violations":18545,"build_seconds":0.48},"status":"discard","description":"Add single-capture fast path to combined_query.matches_per_rule: skip the IndexMap setup + drain when q_match.captures has length 1 (the common case for `(node) @cap`-style patterns like the cluster/datacenter rules). Discarded: 3 runs at 29.76 / 29.50 / 29.87 (mean 29.71) vs prev best 29.20 — slight ~0.5s regression. user_cpu dropped 2s consistently (real CPU savings) but wall didn't follow. The IndexMap path was apparently already cache-friendly enough that the added branching cost outweighs the saved IndexMap ops on the common 1-capture case.","timestamp":1777757580685,"segment":0,"confidence":12.719931271477662,"asi":{"hypothesis":"instrumentation showed combined query ~103 s CPU; per-match IndexMap setup is the inner-loop cost. Single-capture matches (typical for broad-pattern rules like cluster/datacenter) should hit a fast path that skips IndexMap entirely.","rollback_reason":"real CPU savings (-2 s user_cpu, consistent across 3 runs) but wall regressed ~0.5 s. The branching for the fast path (`if raw_captures.len() == 1`) probably defeated some of the compiler's auto-vectorization or cache prefetching that the original tight IndexMap loop was getting. Same pattern as several other CPU-savings-not-translating-to-wall experiments.","fingerprints":"10/10 match — correctness preserved.","lesson_repeated":"CPU savings don't always translate to wall time when the bottleneck is parallelism-limited or cache-bound rather than CPU-bound. The IndexMap allocation cost was small relative to the rest of the per-match work (capture-name Arc::clone, quantifier lookup, Vec::push).","next_action_hint":"the genuine remaining bottlenecks are tree-sitter native (parse + combined query traversal) and v8 dispatch. Both are hard to optimize without bigger architectural changes."}}
{"run":40,"commit":"260dc9f","metric":30.31,"metrics":{"analyzer_seconds":25.635,"peak_rss_mb":1378,"user_cpu_seconds":307.97,"sys_cpu_seconds":32.25,"violations":18545,"build_seconds":0.48},"status":"discard","description":"Skip stats accumulation for truly-empty RuleResults (no violations + no errors) in retain_mut. Discarded: 3 runs at 30.73 / 30.08 / 30.31 (mean 30.37) vs prev 29.20 — consistent ~1.2s regression. The HashMap ops we'd save (~4M stats.execution / .query / .parse calls) turn out to be cheaper than the early-return branching overhead in retain_mut's inner loop, plus user_cpu only dropped 1.6s while wall went up. The HashMap is presumably already cache-resident from previous calls so each op is ~ns.","timestamp":1777757912248,"segment":0,"confidence":12.690857142857142,"asi":{"hypothesis":"for empty RuleResults (most file/rule pairs), the 3 stats HashMap ops in retain_mut are pure overhead (recording 0-time entries). Skipping them should save ~4M ops.","rollback_reason":"consistent +1.2 s regression. user_cpu only -1.6 s (the HashMap ops were already cheap due to cache residency). The new early-return branch (`if !should_retain && !has_errors`) in retain_mut's hot path adds branch-prediction cost or breaks compiler auto-vectorization.","fingerprints":"10/10 match — correctness preserved.","lesson_repeated":"ANOTHER eager-CPU-savings-don't-translate experiment. Already a well-trodden pattern this session: cache-resident hashmap ops are nearly free in tight loops, and adding branches to skip them often costs more than the savings. Cumulative pattern from runs #31, #37, #39, #40.","next_action_hint":"the genuine remaining bottlenecks are in C/native code paths (tree-sitter, v8). Pure Rust micro-opts in this regime tend to discard. If continuing, probably need a structural change (a new dep like simd-json or jwalk) or accept the plateau."}}
{"run":41,"commit":"b54b8a4","metric":28.92,"metrics":{"analyzer_seconds":24.252,"peak_rss_mb":1418,"user_cpu_seconds":304.39,"sys_cpu_seconds":32.29,"violations":18545,"build_seconds":0.48},"status":"keep","description":"Cache GlobSets in PathRestrictions: wrap each PathConfig (per-ruleset and per-rule) in a CompiledPathConfig that pre-builds GlobSets at PathRestrictions construction time. `rule_applies` is on the per (file, rule) hot path (~17M calls on dd-source), and the stock `PathConfig::allows_file` iterates patterns one-at-a-time. GlobSet bulk-matches them in one SIMD pass.","timestamp":1777758417804,"segment":0,"confidence":12.675598631698973,"asi":{"hypothesis":"rule_is_enabled (called from file-level any() screen + per-rule loop, ~17M times on dd-source) goes through PathConfig::allows_file which iterates patterns one-at-a-time. GlobSet bulk-matching should reduce this.","delta_vs_prev_best_s":-0.24,"delta_vs_baseline_s":-222.33,"pct_vs_baseline":-88.49,"delta_user_cpu_s":-5.01,"delta_peak_rss_mb":30,"fingerprints":"10/10 match","verification":"two runs at 29.07 / 28.92, mean 29.00. Stable.","implementation_choice":"wrapped PathConfig in a new local CompiledPathConfig struct inside path_restrictions.rs rather than modifying PathConfig itself. Avoids cascading API changes (44 PathConfig struct-literal constructions across the codebase). The compiled struct keeps the original PathConfig for DiffAware digest while exposing a fast allows_file via cached GlobSet + prefix list. Built once at PathRestrictions construction; shared across all per-(file, rule) calls.","instrumentation_methodology_works_again":"this win came from a methodical re-review of recent instrumentation: noted the screen took ~33s CPU after run #35's reorder, traced rule_is_enabled into path_restrictions::rule_applies which calls PathConfig::allows_file (still iterates patterns), saw the same per-pattern hot loop that GlobSet replaced in run #34's get_files. Applied the same fix in a more localized way to avoid the cascading API changes.","running_count":"6 instrumentation-driven keeps (#27, #34, #35, #36, #38, #41) vs 3 discards (#37, #39, #40)."}}
{"run":42,"commit":"b54b8a4","metric":29.37,"metrics":{"analyzer_seconds":24.699,"peak_rss_mb":1389,"user_cpu_seconds":312.98,"sys_cpu_seconds":32.21,"violations":18545,"build_seconds":0.49},"status":"discard","description":"Sort literals within each pre_screen OR-group by length descending (long/rare first). Discarded: 29.61 / 29.37 vs prev best 28.92 — consistent ~0.5 s regression and +8 s user_cpu. The intuition was wrong: SHORT common literals (e.g. \"subprocess\") were matching fast in most files, getting them out of the way quickly. Pushing them to the end means we now try long rare prefixes first, which fail more often, and the short literal we'd have hit anyway gets checked last.","timestamp":1777758953340,"segment":0,"confidence":12.40334728033473,"asi":{"hypothesis":"longer literals are rarer in random text; trying them first speeds up short-circuit on files that contain *some* literal from the group, and on miss-files the per-call code.contains is faster on rarer first bytes (memchr).","rollback_reason":"the empirical data contradicts the hypothesis. On dd-source many rules have a SHORT common literal (`subprocess`, `request`, `pd`) plus possibly several longer literals. The short common literal matched fast under the original (extraction) order. Sorting by length descending pushed those to the end — so on a file containing the short literal, we now try N-1 long literals first (each a contains call that fails) before finding the short one. Net regression.","fingerprints":"10/10 match — correctness preserved.","lesson_learned":"literal ordering for short-circuit benefits depends on hit rate, not length. Profile-driven ordering would need actual per-literal hit counts. The current extraction order (preserved by my discard) is at least 'random' and works fine on dd-source.","next_action_hint":"the genuine remaining bottleneck IS the contains-per-literal cost in pre_screen.matches, but reordering literals isn't the right lever. Aho-Corasick over all literals with a per-file bitmap would be — but adds aho-corasick as a direct dep (already transitive)."}}
{"run":43,"commit":"99588fa","metric":25.59,"metrics":{"analyzer_seconds":21.006,"peak_rss_mb":1341,"user_cpu_seconds":268.6,"sys_cpu_seconds":31.91,"violations":18545,"build_seconds":0.51},"status":"keep","description":"Aho-Corasick literal pre-screen: build a per-language AC automaton over every literal across all rules' pre-screens at startup; per file, ONE overlapping AC scan populates a HashSet of literals known to be present; pre_screen.matches_with_present(set) does HashSet lookup (~10 ns) instead of per-literal `code.contains` memchr scans (~100s of ns). Replaces O(file_size × n_literals) lazy-iteration with O(file_size) amortized. Two runs at 26.65 / 25.59 (mean 26.12) vs prev best 28.92 = -2.8s wall (-10%); user_cpu 304 → 268 (-36s real CPU). 10/10 fingerprints match. Crucial: must use `find_overlapping_iter` because some literals are prefixes of others (e.g. one rule has \"typ\", another has \"type\"); non-overlapping iteration would emit \"typ\" for \"type(x)\" and skip past, missing \"type\" — causing python-best-practices/type-check-isinstance to miss findings on cloudops in the first attempt.","timestamp":1777759768538,"segment":0,"confidence":12.324412889131622,"asi":{"hypothesis":"the file-level pre-screen (~36s CPU) and per-rule pre-screen check (~9s CPU) are dominated by repeated `code.contains` calls. A per-language Aho-Corasick automaton scans the file ONCE for all literals; per-rule checks become HashSet lookups. Estimated savings: 30-40s CPU = 2s wall. Net wall improvement should be visible above noise.","implementation":"added aho-corasick as direct dep on kernel (already transitive via regex). New module crates/static-analysis-kernel/src/analysis/literal_index.rs with `LiteralIndex { ac, literals }`. `LiteralPreScreen` gains `iter_literals()` (for index population) and `matches_with_present(&HashSet<&str>) -> bool` (for HashSet-based lookup). Adaptive: built only when n_files * n_rules > COMBINED_QUERY_THRESHOLD (10_000), same threshold as combined query — below that, the build cost outweighs savings.","critical_correctness_fix":"first attempt used `find_iter` (non-overlapping). Failed cloudops fingerprints because rules included BOTH `typ` and `type` as separate literals. For text 'if type(x):', non-overlapping AC matched 'typ' first and advanced past it, missing 'type'. Switched to `find_overlapping_iter` (Standard match-kind required) which emits both. Added regression test in literal_index.rs's overlap_test::substring_literals_both_reported.","fingerprints":"10/10 deep check pass after the fix. python-best-practices/type-check-isinstance now correctly fires on cloudops/templates/helpers_module/chef_tag_utils.py (2 findings) just like baseline.","deferred":"could index pre_screen literals to numeric ids and use Vec<bool> instead of HashSet<&str> — but HashSet is plenty fast at <1µs per lookup."}}
{"run":44,"commit":"f99f2ab","metric":24.79,"metrics":{"analyzer_seconds":20.846,"peak_rss_mb":1390,"user_cpu_seconds":268.86,"sys_cpu_seconds":31.83,"violations":18545,"build_seconds":0.49},"status":"keep","description":"Overlap network rule fetch with file walking. Restructured `main` so path_config is FULLY assembled BEFORE the rule fetch (previously gitignore + DEFAULT_IGNORED_GLOBS were applied AFTER the rule fetch); spawned `get_files` on a background OS thread; rule fetch (`get_rules_from_rulesets` + `get_all_default_rulesets`) runs on the main thread concurrently. Joined before per-language setup. Three verification runs at 25.05 / 25.85 / 24.79 (mean 25.23, best 24.79) vs prev best 25.59 → mean -0.36 s, min -0.80 s. analyzer_seconds unchanged (~20.85-21.02), so the savings come entirely from overlapping rule-fetch network I/O (~3 s) with the disk file walk (~1 s).","timestamp":1777760436263,"segment":0,"confidence":12.3176502583628,"asi":{"hypothesis":"Rule fetch (~3-4 s network) and file walking (~1 s disk) currently run sequentially on the main thread. Overlapping them via std::thread::spawn for the walk while rule fetch runs on main saves up to min(fetch, walk) wall time = ~1 s.","implementation":"Split main() rule-fetch logic into two passes: PHASE 1 captures sast_config-derived state (paths, max_file_size_kb, ignore_generated_files, ignore_gitignore, explicit_rs_owned, excluded_rulesets) without making any network calls; PHASE 2 finalizes path_config (gitignore + ignore options + DEFAULT_IGNORED_GLOBS); PHASE 3 spawns get_files on a background OS thread; PHASE 4 does the network rule fetches on the main thread; the walk join happens just before per-language setup. The thread spawn moves a clone of path_config + dir + subdirs; walk's local rayon pool is unaffected.","fingerprints":"10/10 deep check pass.","nuance":"Savings depend on network timing of the rule-fetch (varies run-to-run). Best run 24.79 (-0.8 s vs prev best); slowest run 25.85 (no improvement) shows the upper-bound case where fetch < walk and the walk is the long pole. Mean still improves clearly (-0.36 s).","lesson_learned":"the original code was trapped in a sequential chain where path_config setup was INTERLEAVED with rule fetch; restructuring into two clean phases (data-prep then network) unlocked the overlap. Worth checking other monorepo tools for similar interleaving patterns."}}
{"run":45,"commit":"f99f2ab","metric":0,"metrics":{"analyzer_seconds":0,"peak_rss_mb":0,"user_cpu_seconds":0,"sys_cpu_seconds":0,"violations":0,"build_seconds":0},"status":"crash","description":"Spawn v8 init on a background OS thread alongside rule fetch + file walk to overlap the ~1-2s init cost. Crashed: SIGSEGV during cloudops fingerprint check (PKU-related segfault). v8_platform.rs:108-115 explicitly requires initialize_v8 to be called on the parent thread of all v8-accessing child threads — moving it to a side thread breaks PKU register inheritance: rayon worker threads spawned later by the main thread don't have PKU set up, segfault on first v8 use.","timestamp":1777760663078,"segment":0,"confidence":12.3176502583628,"asi":{"hypothesis":"v8 init (~1-2 s) currently runs serially after rule fetch + walk join. Spawning it in a side thread would let it overlap with rule fetch, saving ~1-2 s wall.","rollback_reason":"SIGSEGV on cloudops on first benchmark run. Root cause documented in crates/static-analysis-kernel/src/analysis/ddsa_lib/v8_platform.rs:108-115: 'This should only be called from the parent thread of all child threads that will access v8. ... on modern Linux systems running on hardware supporting Memory Protection Keys, a segfault will trigger.' PKU keys are process-wide but the PKRU register is per-thread; threads inherit the parent's PKRU at spawn time. If main thread isn't PKU-enabled when it later calls rayon::build_global, the rayon workers don't inherit PKU, then segfault on v8 use.","next_action_hint":"this optimization is fundamentally incompatible with PKU on modern Linux + v8. Workarounds: (a) initialize PKU on main thread separately from the rest of v8 init (would need v8 API support, deep change); (b) build rayon global pool on the v8-initialized thread (very invasive); (c) accept the v8 init cost as part of the critical path. Add to don't-try list.","lesson_learned":"always check architectural constraints in module docs BEFORE attempting parallelization. The v8_platform.rs doc explicitly warned about this; missed it on first read."}}
{"run":46,"commit":"f99f2ab","metric":25.43,"metrics":{"analyzer_seconds":21.48,"peak_rss_mb":1382,"user_cpu_seconds":276.92,"sys_cpu_seconds":31.83,"violations":18545,"build_seconds":0.47},"status":"discard","description":"Switch release-dev profile to `lto = \"thin\"` for cross-crate inlining (regex, aho-corasick, hashbrown, globset). Discarded: 25.33 / 25.43 (mean 25.38) vs prev best mean 25.23 — slightly worse and within noise; user_cpu UP consistently +7-8 s (276 vs 269) suggesting LTO inlining decisions slowed some hot paths. Also: clean build time exploded from ~30 s to **4 m 43 s** (huge build-tax for a non-improvement). Discard.","timestamp":1777761235343,"segment":0,"confidence":12.26760563380282,"asi":{"hypothesis":"Thin LTO would enable cross-crate inlining of the per-file hot paths (AC find_overlapping_iter, std HashMap hashing, globset matching, regex), giving 2-10% wall improvement.","rollback_reason":"no measurable wall improvement (25.38 mean vs 25.23 baseline mean = within noise) AND user_cpu went UP +7s consistently. LTO's inlining decisions are not always faster — cross-crate inlining can cause register pressure or icache evictions that pessimize hot paths.","build_cost":"clean build time rocketed from ~30s to 4m43s. A huge tax for any new contributor's first build. Even if the runtime were marginally better, this would be a net negative.","next_action_hint":"LTO is not the lever for this codebase. Consider: (a) PGO (profile-guided optimization) which targets actual hot paths from a profiling run — more invasive but can yield 5-15% on CPU-bound workloads. (b) Accept current plateau and look at structural improvements that change algorithms, not compiler flags.","lesson_learned":"compiler flags alone rarely produce meaningful improvements once high-quality release builds are already in use. The win was small enough that the bench can't distinguish from noise; the build-cost spike is real."}}
{"run":47,"commit":"f99f2ab","metric":26.62,"metrics":{"analyzer_seconds":22.688,"peak_rss_mb":1372,"user_cpu_seconds":277.18,"sys_cpu_seconds":31.51,"violations":18545,"build_seconds":0.5},"status":"discard","description":"Replace std `HashSet<&str>` with `rustc_hash::FxHashSet<&str>` for the AC `present_literals` set (used during file-level pre-screen). Discarded: 26.70 / 26.62 (mean 26.66) vs prev best mean 25.23 — consistent ~1.4 s regression and +7-8 s user_cpu (276-277 vs 268-269). Both analyzer_seconds (22.69) and wall regressed; the optimization did not help and may be perturbing inlining or cache locality of hot paths.","timestamp":1777761610436,"segment":0,"confidence":12.40536839222131,"asi":{"hypothesis":"FxHash (non-cryptographic) is 2-3x faster than SipHash (std default) for short string keys; replacing std HashSet with FxHashSet for the per-file present_literals set should save ~1-2 s CPU = ~100 ms wall.","rollback_reason":"consistent regression across 2 runs (26.70, 26.62 vs prev mean 25.23), +7-8 s user_cpu, +2 s analyzer_seconds. Not noise. Possible explanations: (a) FxHash on the specific literal-string distribution may produce more collisions than expected, slowing lookups; (b) adding rustc-hash as a direct dep changed monomorphization / inlining of HashSet APIs in a pessimizing way; (c) the rustc-hash crate's hasher imports may force a different version selection vs the transitive dep through tree-sitter.","next_action_hint":"if HashSet ops are truly a bottleneck, the right answer is Vec<bool> indexed by literal_id (O(1) lookup, no hashing), but it requires refactoring LiteralPreScreen to store ids instead of strings. Defer unless a profile shows present_in is >2 s wall. Right now the AC scan itself dominates and is native; HashSet is a second-order term.","lesson_learned":"swapping hashers without measuring isn't free. Every additional crate / generic instantiation can perturb the compiler's inlining and code layout in ways that pessimize hot paths."}}
{"run":48,"commit":"f99f2ab","metric":25.96,"metrics":{"analyzer_seconds":22.097,"peak_rss_mb":1263,"user_cpu_seconds":267.68,"sys_cpu_seconds":31.69,"violations":18545,"build_seconds":5.83},"status":"discard","description":"Stability verification on the current best commit (no code changes). 25.96 s vs prev best 24.79 — within the established noise band (run #44 had 25.05/25.85/24.79, mean 25.23). user_cpu 267.68 matches the established baseline ~268 s. analyzer_seconds 22.10 is at the upper edge of the 20.85-21 range. Confirms the recent FxHash and LTO discards weren't system drift; they were genuine regressions.","timestamp":1777761691264,"segment":0,"confidence":12.546260387811634,"asi":{"hypothesis":"verify steady state on the current best after recent discards — rule out system thermal / page-cache drift as a confound.","result":"current best commit (run #44, rule fetch + walk overlap) reproduces in the established 25-26 s warm-cache range. 24.79 s remains the best individual run; the practical mean is ~25.5. user_cpu 267.68 matches the established baseline.","rollback_reason":"no code change; metric is in the established range, not at or below the all-time-best 24.79.","next_action_hint":"the plateau is real. Further wins likely require structural changes (e.g. PGO, custom v8 dispatch batching, separate rayon pool for setup vs analysis). Update ideas backlog and consider stopping if no concrete next step."}}
